product_code,category,product_price,subcategory,product_name
10916,Beauty and Skincare,"52,70 €",Neck and Neckline,NeoStrata™ Skin Active Neck and Neck Cream 80g
84909,Beauty and Skincare,"31,49 €",Neck and Neckline,Sensilis Upgrade Chrono Lifting Fluido day SPF20 50ml
61747,Beauty and Skincare,"30,19 €",Neck and Neckline,Lancaster Suractif Comfort Lift Neck&Decollete Cream 50ml
34837,Beauty and Skincare,"12,89 €",Neck and Neckline,Beautiful Aurora Splendor neck neckline 50ml
24004,Beauty and Skincare,"14,95 €",Neck and Neckline,Sesderma Daeses mascarilla reafirmante 75ml
66763,Beauty and Skincare,"4,59 €",Neck and Neckline,Talika Bioenzymes Cleavage Glow Mask for Segmented Cleavage Skin
34160,Beauty and Skincare,"60,29 €",Neck and Neckline,Skinceuticals Neck Chest and Hand Repair 60ml
33026,Beauty and Skincare,"9,39 €",Neck and Neckline,Life Gold Premier Regenerating cream 150ml
78152,Beauty and Skincare,"16,99 €",Neck and Neckline,Postquam Luxury Gold neck and neckline cream 150ml
225134,Beauty and Skincare,"18,59 €",Neck and Neckline,"Natura Siberica Kam-chat-ka cream for neck and neckline flowers of the rtico, firming 200 ml"
89585,Beauty and Skincare,"133,59 €",Neck and Neckline,Sisley Sisleya L'integral Anti-age Lip & Eye Cream 15ml
225047,Beauty and Skincare,"11,39 €",Neck and Neckline,Natura Siberica Lifting cream for neck and décolleté 120 ml
163104,Beauty and Skincare,"2,29 €",Neck and Neckline,Prism Natural Neck Mask Collagen Powder Gold
12625,Beauty and Skincare,"23,59 €",Neck and Neckline,Plante System Instant Lift cream 50ml
36020,Beauty and Skincare,"28,79 €",Neck and Neckline,Germinal Soybean 50ml
64256,Beauty and Skincare,"32,49 €",Neck and Neckline,Irati Organic cream Q10 and vegetable elastin 50ml
66841,Beauty and Skincare,"57,99 €",Neck and Neckline,Dr. Hauschka Neck & Neck Regenerating Cream 40ml
88105,Beauty and Skincare,"76,99 €",Neck and Neckline,Clarins Advanced Extra-firming Neck 50ml
161113,Beauty and Skincare,"86,39 €",Neck and Neckline,Perricone Md Cold Plasma+ Neck & Chest 30ml
136122,Beauty and Skincare,"43,01 €",Neck and Neckline,Dior Hydralife Cooling Hydration Sorbet Eye Gel 15ml
31387,Beauty and Skincare,"45,59 €",Neck and Neckline,Lierac Bust-lift anti-ageing cream for bust and décolleté 75ml
31046,Beauty and Skincare,"29,89 €",Neck and Neckline,Florame Neck and Neck Balm Lys Perfection 50ml
233133,Beauty and Skincare,"17,99 €",Neck and Neckline,Maystar Body & Breast’s Reaffirming-Modelling Cream 200 ml
134626,Beauty and Skincare,"64,89 €",Neck and Neckline,Jeanne Piaubert Suprem'advance Premium Complete Anti-ageing Crea
134904,Beauty and Skincare,"26,59 €",Neck and Neckline,Sisley Sisley Brosse Douce Visage Et Cou
172557,Beauty and Skincare,"43,99 €",Neck and Neckline,Clarins Body Bust Gel Lift 50ml
89589,Beauty and Skincare,"68,69 €",Neck and Neckline,Sisley Mousse Creme Nettoyante Demaquillante 125ml
89591,Beauty and Skincare,"440,79 €",Neck and Neckline,Sisley Supremya La Nuit Anti-age Creme 50ml
129247,Beauty and Skincare,"66,99 €",Neck and Neckline,Clarins Concentre Decollete Et Cou Multi-intensif Anti-taches 75
189524,Beauty and Skincare,"27,69 €",Neck and Neckline,Gamarde Présâge Fluid Contours 20g
29628,Beauty and Skincare,"20,22 €",Neck and Neckline,Innoatek Face-Up anti-double chin patches 3 u.
87721,Beauty and Skincare,"69,63 €",Neck and Neckline,Elisabeth Arden Anti-age Moisture Cream 50ml
134912,Beauty and Skincare,"106,29 €",Neck and Neckline,Sisley Pour Le Cou Cream 50ml
130112,Beauty and Skincare,"46,19 €",Neck and Neckline,Thalgo Buste Et Decollette 50 Ml
65548,Beauty and Skincare,"18,59 €",Neck and Neckline,Seizen neck + neckline cream caviar 150ml
11732,Beauty and Skincare,"66,79 €",Neck and Neckline,Atashi™ Hoseki Neck and Neck Serum 50ml
187927,Beauty and Skincare,"29,89 €",Neck and Neckline,Boots Serum 7 Eye Contour Cream 15ml
29625,Beauty and Skincare,"38,39 €",Neck and Neckline,Innoatek Up-Belle
34504,Beauty and Skincare,"15,50 €",Neck and Neckline,Natura Siberica anti-ageing lifting cream for neck and décolleté 120ml
180123,Beauty and Skincare,"22,49 €",Neck and Neckline,DERMATOLINE COSMETIC Lift Effect Eye contour care 15 ml tube
174424,Beauty and Skincare,"49,99 €",Neck and Neckline,Occit Immort Divine Eye 15Ml
180344,Beauty and Skincare,"5,90 €",Neck and Neckline,Gamarde Pres Age Dermonag Care
50653,Beauty and Skincare,"16,90 €",Neck and Neckline,Miraur Essential cream neck and décolleté 50ml
59721,Beauty and Skincare,"27,12 €",Neck and Neckline,Wild Herbs nourishing cream floral waxes 50ml
136149,Beauty and Skincare,"57,95 €",Neck and Neckline,Jeanne Piaubert Isowhite Lightening Cream Global Facial 50ml
81034,Beauty and Skincare,"69,48 €",Neck and Neckline,Shiseido Benefiance Concentrate Neck 50ml
74725,Beauty and Skincare,"14,90 €",Neck and Neckline,Simon & Tom™ Premium Lift Neck Firming Cream 100ml
34503,Beauty and Skincare,"16,90 €",Neck and Neckline,Natura Siberica Frosty Neck and Neck Lift Mask 120ml
66764,Beauty and Skincare,"9,25 €",Neck and Neckline,Talika Bioenzymes Anti-ageing Mask with Segmented Neck Skin
23831,Beauty and Skincare,"10,61 €",Neck and Neckline,Naturaloe moisturising cream 50ml
86866,Beauty and Skincare,"45,64 €",Neck and Neckline,Clarins Ultrafirmeza Breast Milk 50ml
86867,Beauty and Skincare,"49,90 €",Neck and Neckline,Clarins Extra Lift Bust Gel 100ml
89220,Beauty and Skincare,"84,32 €",Neck and Neckline,Progressif Face Lift Fermete Jeunesse Originelle Cou Et Decoll
191636,Beauty and Skincare,"6,99 €",Neck and Neckline,Natessance Prickly Flower Oil 50 ml
189296,Beauty and Skincare,"23,20 €",Neck and Neckline,Lierac Diopticerne Anticerne Colourless and Duo Tinted
198749,Beauty and Skincare,"55,19 €",Neck and Neckline,Lysedia Lifting Anti-Wrinkle Eye Contour Lifting 30Ml
175756,Beauty and Skincare,"18,59 €",Neck and Neckline,Weleda Grenade Eye Contour 10 Ml
89586,Beauty and Skincare,"111,02 €",Neck and Neckline,Sisley Sisleya Soin Des Mains Global Anti-age Creme Treatment 75
63405,Beauty and Skincare,"77,00 €",Neck and Neckline,Rodial Glamoxy Chin & Neck Lift 50ml
59719,Beauty and Skincare,"23,92 €",Neck and Neckline,Wild Herbs Neck Cream 50ml
34503,Beauty and Skincare,"16,90 €",Neck and Neckline,Natura Siberica Frosty Neck and Neck Lift Mask 120ml
175756,Beauty and Skincare,"18,59 €",Neck and Neckline,Weleda Grenade Eye Contour 10 Ml
50653,Beauty and Skincare,"16,90 €",Neck and Neckline,Miraur Essential cream neck and décolleté 50ml
59721,Beauty and Skincare,"27,12 €",Neck and Neckline,Wild Herbs nourishing cream floral waxes 50ml
74725,Beauty and Skincare,"14,90 €",Neck and Neckline,Simon & Tom™ Premium Lift Neck Firming Cream 100ml
81034,Beauty and Skincare,"69,48 €",Neck and Neckline,Shiseido Benefiance Concentrate Neck 50ml
136149,Beauty and Skincare,"57,95 €",Neck and Neckline,Jeanne Piaubert Isowhite Lightening Cream Global Facial 50ml
174424,Beauty and Skincare,"49,99 €",Neck and Neckline,Occit Immort Divine Eye 15Ml
180344,Beauty and Skincare,"5,90 €",Neck and Neckline,Gamarde Pres Age Dermonag Care
